{
  "agentId": "development-workflow",
  "scratchpad": {
    "currentTask": null,
    "notes": [],
    "lastUpdated": "2025-10-20T06:40:39.969Z",
    "summary": null
  },
  "longTermMemory": [],
  "metadata": {
    "environment": "development",
    "version": "1.0.0",
    "lastCheckpoint": "2025-10-20T06:40:39.982Z",
    "checksum": "815348bc746b77a6d18f8fac2688c01529970cad1cf6358c173116343437eb48"
  }
}