{
  "agentId": "observability",
  "scratchpad": {
    "currentTask": null,
    "notes": [],
    "lastUpdated": "2025-10-20T06:40:39.969Z",
    "summary": null
  },
  "longTermMemory": [],
  "metadata": {
    "environment": "production",
    "version": "1.0.0",
    "lastCheckpoint": "2025-10-27T23:59:00.000Z",
    "checksum": "46932bb9329db0ca14a3cb00d8b225d65ccdfd10032f5e4163cd32a3ad3e49b0"
  }
}
